{
  "meta": {
    "title": "Product — story map",
    "formatVersion": 2,
    "description": "Duplicate this file; set columns, milestones, cards — see docs/format.md. One card per (milestoneId, userStoryId); refs list all T### for that US in that milestone."
  },
  "columns": [
    {
      "id": "step1",
      "label": "First user step",
      "order": 0
    }
  ],
  "milestones": [
    {
      "id": "now",
      "label": "Now",
      "order": 0,
      "color": "#5b8def"
    }
  ],
  "cards": [
    {
      "id": "card-1",
      "columnId": "step1",
      "title": "First story",
      "milestoneId": "now",
      "userStoryId": "US.1",
      "status": "planned"
    }
  ]
}
